<?xml version="1.0" encoding="UTF-8"?>
<additionalReference xmlns:xsi="http://www.w3.org/2001/XMLSchema-instance" xsi:noNamespaceSchemaLocation="Wrapper.xsd">
	<secondaryDataLocator xpointer="premis.xml#ID_C7A0B99F-C0BF-4DB9-B163-B64DF8BFCF89">
		<mdWrap>
			<property key="Version" value="1"/>
			<property key="Renderer" value="00000000000000000000000000000000"/>
			<property key="EingechecktVon" value="Egloff Gregor; GREGOR.EGLOFF@LU.CH"/>
			<property key="CheckInDate" value="15.04.2019 12:01:00"/>
		</mdWrap>
	</secondaryDataLocator>
	<secondaryDataLocator xpointer="premis.xml#ID_E5225E20-F2BB-476D-BC73-A45FE2F9F10E">
		<mdWrap>
			<property key="Version" value="1"/>
			<property key="Renderer" value="0a150a150a150a150a150a150a150a15"/>
			<property key="EingechecktVon" value="0a150a150a150a150a150a150a150a15"/>
			<property key="CheckInDate" value="15.04.2019 12:03:50"/>
		</mdWrap>
	</secondaryDataLocator>
	<secondaryDataLocator>xpointer="premis.xml#ID_E5225E20-F2BB-476D-BC73-A45FE2F9F10E"</secondaryDataLocator>
	<secondaryDataLocator obligation="optional" origin="test" archivalOrigin="true" xpointer="premis.xml#ID_E5225E20-F2BB-476D-BC73-A45FE2F9F10E"/>
</additionalReference>
